{"actual_read_set":[{"artifact_id":"artifact_01j00000000000000000000001","content_hash":"def81af2ea85a2bb3ce0c0e49607aeccceb25734ad5b64cf978b6697d0a56c75","content_hash_algorithm":"sha256","event_id":"event_01j00000000000000000000004","record_id":"record_01j00000000000000000000001","relative_path":"examples/execution_contract/synthetic_run/artifacts/input.json"}],"actual_write_set":[{"artifact_id":"artifact_01j00000000000000000000002","content_hash":"94c42a41e538829a75fa1cab004620b00f7cb36a7c315dba4bb2f93c6856853a","content_hash_algorithm":"sha256","event_id":"event_01j00000000000000000000005","record_id":null,"relative_path":"examples/execution_contract/synthetic_run/artifacts/output.json"}],"as_of_event_id":"event_01j00000000000000000000009","as_of_occurred_at":"2026-01-01T00:00:09Z","attempt_no":1,"candidate_next_nodes":[{"node_id":"source_identity","reason":"required inputs exist; node has not been executed","stage_id":"S01","status":"ready"}],"completed_actions":[{"action_key":"task_completed","source_event_id":"event_01j00000000000000000000007","summary":"the bounded synthetic transformation completed and validated"},{"action_key":"checkpoint_created","source_event_id":"event_01j00000000000000000000008","summary":"created immutable checkpoint checkpoint_01j00000000000000000000000"},{"action_key":"handoff_finalized","source_event_id":"event_01j00000000000000000000009","summary":"created and registered HANDOFF Artifact artifact_01j00000000000000000000003"}],"current_state_version":"current_state_v1.0.0","dag_version":"youtube_truthfulness_dag_v1.1.0","event_count":9,"event_head_hash":"e4dad2bd64065c4d25118a011b48a1bc5cfe33f7d60b4cbdaced2f4e919e5bf1","input_artifacts":[{"artifact_id":"artifact_01j00000000000000000000001","artifact_type":"synthetic.input","content_hash":"def81af2ea85a2bb3ce0c0e49607aeccceb25734ad5b64cf978b6697d0a56c75","content_hash_algorithm":"sha256","input_fingerprint":null,"lifecycle_state":"validated","record_id":"record_01j00000000000000000000001","relative_path":"examples/execution_contract/synthetic_run/artifacts/input.json","validation_status":"passed"}],"invalidated_artifacts":[],"output_artifacts":[{"artifact_id":"artifact_01j00000000000000000000002","artifact_type":"synthetic.output","content_hash":"94c42a41e538829a75fa1cab004620b00f7cb36a7c315dba4bb2f93c6856853a","content_hash_algorithm":"sha256","input_fingerprint":null,"lifecycle_state":"validated","record_id":"record_01j00000000000000000000002","relative_path":"examples/execution_contract/synthetic_run/artifacts/output.json","validation_status":"passed"}],"pending_human_decisions":[],"registry_heads":[{"artifact_count":3,"content_hash":"59e7501d3e859644e67a8edf00d447b8a3267789d2b71e44c0e98720c3d66dc7","content_hash_algorithm":"sha256","head_record_hash":"879a99655959aa943ec24b31c9215979332de390bfcdb0dea318e82553b94031","head_record_id":"record_01j00000000000000000000003","record_count":3,"registry_scope":"run","relative_path":"examples/execution_contract/synthetic_run/artifact_registry.jsonl"}],"remaining_actions":[{"action_key":"execute_source_identity","summary":"required inputs exist; node has not been executed"}],"run_id":"run_01j00000000000000000000000","session_id":"session_01j00000000000000000000000","stage_id":"S01","state_hash":"0e7b30ed046ae4893b4e2c8a8e9ca3b8048a105bf46cd9ec98259cd507dee80e","status":"COMPLETED","task_id":"task_01j00000000000000000000000","validation_summary":{"failed_count":0,"overall_status":"passed","partial_count":0,"passed_count":1,"validators":[{"result":"passed","validation_artifact_id":null,"validator_id":"synthetic.schema","validator_version":"1.0.0"}]},"workflow_version":"youtube_truthfulness_workflow_v1.1.0"}
